Nome,Idade,Descrição
João Silva,35,João é um programador experiente, que adora viajar e experimentar novas comidas.
Maria Santos,27,Maria é uma fotógrafa apaixonada pela natureza e pela arte de contar histórias através de imagens.
Pedro Almeida,42,Pedro é um empresário bem sucedido, que gosta de praticar esportes e passar tempo com sua família.
Ana Souza,19,Ana é uma estudante de psicologia que ama ler e escrever poesias nas horas vagas.
Felipe Lima,31,Felipe é um designer gráfico criativo e apaixonado por música, que adora passar tempo com seus amigos e família.